<?xml version="1.0" encoding="UTF-8" standalone="yes"?>
<sales xmlns:xsi="http://www.w3.org/2001/XMLSchema-instance"
       xmlns="http://http://by.yahimovich/task07/src/main/resources"
       xsi:schemaLocation="http://http://by.yahimovich/task07/src/main/resources data.xsd
">
    <subscription_sale id="1">
        <card_number>1</card_number>
        <user_id>1</user_id>
        <start_date>12.02.2022 11:00</start_date>
        <end_date>12.03.2022 11:00</end_date>
        <service_id>2</service_id>
        <client>
            <id_client>1</id_client>
            <f_name_client>Yahimovich</f_name_client>
            <s_name_client>Egor</s_name_client>
            <l_name_client>Aleksandrovich</l_name_client>
            <address_client>Vileyka</address_client>
            <phone_client>+375333139380</phone_client>
        </client>
        <subscription>
            <id_sub>1</id_sub>
            <name_sub>Premium</name_sub>
            <price>50</price>
            <visits>15</visits>
            <days>30</days>
        </subscription>
        <specialization>
            <id_spec>1</id_spec>
            <note>Master of Sport</note>
            <service>
                <id_serv>2</id_serv>
                <name_serv>powerlifting</name_serv>
            </service>
            <employee>
                <id_employee>2</id_employee>
                <f_name_employee>Scridlevskiy</f_name_employee>
                <s_name_employee>Aleksey</s_name_employee>
                <l_name_employee>Aleksandrovich</l_name_employee>
                <address_employee>Slyck</address_employee>
                <phone_employee>+375294859261</phone_employee>
            </employee>
        </specialization>
    </subscription_sale>
    <subscription_sale id="2">
        <card_number>2</card_number>
        <user_id>1</user_id>
        <start_date>12.02.2022 11:00</start_date>
        <end_date>12.03.2022 11:00</end_date>
        <service_id>2</service_id>
        <client>
            <id_client>1</id_client>
            <f_name_client>Pavlovich</f_name_client>
            <s_name_client>Egor</s_name_client>
            <l_name_client>Aleksandrovich</l_name_client>
            <address_client>Vileyka</address_client>
            <phone_client>+375333139380</phone_client>
        </client>
        <subscription>
            <id_sub>1</id_sub>
            <name_sub>Premium</name_sub>
            <price>50</price>
            <visits>15</visits>
            <days>30</days>
        </subscription>
        <specialization>
            <id_spec>1</id_spec>
            <note>Master of Sport</note>
            <service>
                <id_serv>2</id_serv>
                <name_serv>powerlifting</name_serv>
            </service>
            <employee>
                <id_employee>2</id_employee>
                <f_name_employee>Scridlevskiy</f_name_employee>
                <s_name_employee>Aleksey</s_name_employee>
                <l_name_employee>Aleksandrovich</l_name_employee>
                <address_employee>Slyck</address_employee>
                <phone_employee>+375294859261</phone_employee>
            </employee>
        </specialization>
    </subscription_sale>
    <subscription_sale id="3">
        <card_number>3</card_number>
        <user_id>1</user_id>
        <start_date>12.02.2022 11:00</start_date>
        <end_date>12.03.2022 11:00</end_date>
        <service_id>2</service_id>
        <client>
            <id_client>1</id_client>
            <f_name_client>Skridlevskiy</f_name_client>
            <s_name_client>Egor</s_name_client>
            <l_name_client>Aleksandrovich</l_name_client>
            <address_client>Vileyka</address_client>
            <phone_client>+375333139380</phone_client>
        </client>
        <subscription>
            <id_sub>1</id_sub>
            <name_sub>Premium</name_sub>
            <price>50</price>
            <visits>15</visits>
            <days>30</days>
        </subscription>
        <specialization>
            <id_spec>1</id_spec>
            <note>Master of Sport</note>
            <service>
                <id_serv>2</id_serv>
                <name_serv>powerlifting</name_serv>
            </service>
            <employee>
                <id_employee>2</id_employee>
                <f_name_employee>Scridlevskiy</f_name_employee>
                <s_name_employee>Aleksey</s_name_employee>
                <l_name_employee>Aleksandrovich</l_name_employee>
                <address_employee>Slyck</address_employee>
                <phone_employee>+375294859261</phone_employee>
            </employee>
        </specialization>
    </subscription_sale>
    <subscription_sale id="4">
        <card_number>4</card_number>
        <user_id>1</user_id>
        <start_date>11.02.2022 11:00</start_date>
        <end_date>11.03.2022 11:00</end_date>
        <service_id>2</service_id>
        <client>
            <id_client>1</id_client>
            <f_name_client>Pavlovich</f_name_client>
            <s_name_client>Egor</s_name_client>
            <l_name_client>Aleksandrovich</l_name_client>
            <address_client>Vileyka</address_client>
            <phone_client>+375333139380</phone_client>
        </client>
        <subscription>
            <id_sub>1</id_sub>
            <name_sub>Premium</name_sub>
            <price>50</price>
            <visits>15</visits>
            <days>30</days>
        </subscription>
        <specialization>
            <id_spec>1</id_spec>
            <note>Master of Sport</note>
            <service>
                <id_serv>2</id_serv>
                <name_serv>powerlifting</name_serv>
            </service>
            <employee>
                <id_employee>2</id_employee>
                <f_name_employee>Scridlevskiy</f_name_employee>
                <s_name_employee>Aleksey</s_name_employee>
                <l_name_employee>Aleksandrovich</l_name_employee>
                <address_employee>Slyck</address_employee>
                <phone_employee>+375294859261</phone_employee>
            </employee>
        </specialization>
    </subscription_sale>
    <subscription_sale id="5">
        <card_number>5</card_number>
        <user_id>1</user_id>
        <start_date>12.02.2022 11:00</start_date>
        <end_date>12.03.2022 11:00</end_date>
        <service_id>2</service_id>
        <client>
            <id_client>1</id_client>
            <f_name_client>Pavlovich</f_name_client>
            <s_name_client>Egor</s_name_client>
            <l_name_client>Aleksandrovich</l_name_client>
            <address_client>Vileyka</address_client>
            <phone_client>+375333139380</phone_client>
        </client>
        <subscription>
            <id_sub>1</id_sub>
            <name_sub>Premium</name_sub>
            <price>50</price>
            <visits>15</visits>
            <days>30</days>
        </subscription>
        <specialization>
            <id_spec>1</id_spec>
            <note>Master of Sport</note>
            <service>
                <id_serv>2</id_serv>
                <name_serv>powerlifting</name_serv>
            </service>
            <employee>
                <id_employee>2</id_employee>
                <f_name_employee>Scridlevskiy</f_name_employee>
                <s_name_employee>Aleksey</s_name_employee>
                <l_name_employee>Aleksandrovich</l_name_employee>
                <address_employee>Slyck</address_employee>
                <phone_employee>+375294859261</phone_employee>
            </employee>
        </specialization>
    </subscription_sale>
    <subscription_sale id="6">
        <card_number>6</card_number>
        <user_id>1</user_id>
        <start_date>12.02.2022 11:00</start_date>
        <end_date>12.03.2022 11:00</end_date>
        <service_id>2</service_id>
        <client>
            <id_client>1</id_client>
            <f_name_client>Pavlovich</f_name_client>
            <s_name_client>Egor</s_name_client>
            <l_name_client>Aleksandrovich</l_name_client>
            <address_client>Vileyka</address_client>
            <phone_client>+375333139380</phone_client>
        </client>
        <subscription>
            <id_sub>1</id_sub>
            <name_sub>Premium</name_sub>
            <price>50</price>
            <visits>15</visits>
            <days>30</days>
        </subscription>
        <specialization>
            <id_spec>1</id_spec>
            <note>Master of Sport</note>
            <service>
                <id_serv>2</id_serv>
                <name_serv>running</name_serv>
            </service>
            <employee>
                <id_employee>2</id_employee>
                <f_name_employee>Scridlevskiy</f_name_employee>
                <s_name_employee>Aleksey</s_name_employee>
                <l_name_employee>Aleksandrovich</l_name_employee>
                <address_employee>Slyck</address_employee>
                <phone_employee>+375294859261</phone_employee>
            </employee>
        </specialization>
    </subscription_sale>
    <subscription_sale id="7">
        <card_number>7</card_number>
        <user_id>1</user_id>
        <start_date>12.02.2022 11:00</start_date>
        <end_date>12.03.2022 11:00</end_date>
        <service_id>2</service_id>
        <client>
            <id_client>1</id_client>
            <f_name_client>Pavlovich</f_name_client>
            <s_name_client>Egor</s_name_client>
            <l_name_client>Aleksandrovich</l_name_client>
            <address_client>Vileyka</address_client>
            <phone_client>+375333139380</phone_client>
        </client>
        <subscription>
            <id_sub>1</id_sub>
            <name_sub>Premium</name_sub>
            <price>50</price>
            <visits>15</visits>
            <days>30</days>
        </subscription>
        <specialization>
            <id_spec>1</id_spec>
            <note>Master of Sport</note>
            <service>
                <id_serv>2</id_serv>